[
  {
    "id": "aggregation-five-minute-interleaving",
    "rules": ["RAW-001", "THREAD-001", "PARTIAL-001"],
    "articleAuthor": "op",
    "rawPushes": [
      { "type": "neutral", "author": "alice", "content": "前半段", "time": "01/01 12:00" },
      { "type": "neutral", "author": "bob", "content": "插話。", "time": "01/01 12:01" },
      { "type": "neutral", "author": "alice", "content": "後半段", "time": "01/01 12:05" }
    ],
    "expected": {
      "replies": [
        { "author": "alice", "content": "前半段\n後半段", "replyToAuthor": null, "score": 0 },
        { "author": "bob", "content": "插話。", "replyToAuthor": null, "score": 0 }
      ],
      "nativeArticleScore": 0,
      "articlePushVoters": [],
      "articleBooVoters": []
    },
    "stages": [
      {
        "complete": false,
        "rawPushCount": 1,
        "expected": {
          "replies": [
            { "author": "alice", "content": "前半段", "replyToAuthor": null, "score": 0 }
          ],
          "nativeArticleScore": 0,
          "articlePushVoters": [],
          "articleBooVoters": [],
          "status": "incomplete"
        }
      },
      {
        "complete": true,
        "rawPushCount": 3,
        "expected": {
          "replies": [
            { "author": "alice", "content": "前半段\n後半段", "replyToAuthor": null, "score": 0 },
            { "author": "bob", "content": "插話。", "replyToAuthor": null, "score": 0 }
          ],
          "nativeArticleScore": 0,
          "articlePushVoters": [],
          "articleBooVoters": [],
          "status": "final"
        }
      }
    ]
  },
  {
    "id": "aggregation-forced-continuation-different-target",
    "rules": ["THREAD-002", "THREAD-006"],
    "articleAuthor": "op",
    "rawPushes": [
      { "type": "neutral", "author": "root-a", "content": "A。", "time": "01/01 12:00" },
      { "type": "neutral", "author": "root-b", "content": "B。", "time": "01/01 12:01" },
      { "type": "neutral", "author": "alice", "content": "回1樓：前段||", "time": "01/01 12:02" },
      { "type": "neutral", "author": "alice", "content": "回2樓：不同目標", "time": "01/01 12:03" }
    ],
    "expected": {
      "replies": [
        { "author": "root-a", "content": "A。", "replyToAuthor": null, "score": 0 },
        { "author": "root-b", "content": "B。", "replyToAuthor": null, "score": 0 },
        { "author": "alice", "content": "前段", "replyToAuthor": "root-a", "score": 0 },
        { "author": "alice", "content": "不同目標", "replyToAuthor": "root-b", "score": 0 }
      ],
      "nativeArticleScore": 0,
      "articlePushVoters": [],
      "articleBooVoters": []
    }
  },
  {
    "id": "aggregation-forced-continuation-continuous-six-minutes",
    "rules": ["THREAD-002"],
    "articleAuthor": "op",
    "rawPushes": [
      { "type": "neutral", "author": "root", "content": "根。", "time": "01/01 12:00" },
      { "type": "neutral", "author": "alice", "content": "回1樓：前段。||", "time": "01/01 12:01" },
      { "type": "neutral", "author": "alice", "content": "回1樓：六分鐘後", "time": "01/01 12:07" }
    ],
    "expected": {
      "replies": [
        { "author": "root", "content": "根。", "replyToAuthor": null, "score": 0 },
        { "author": "alice", "content": "前段。\n六分鐘後", "replyToAuthor": "root", "score": 0 }
      ],
      "nativeArticleScore": 0,
      "articlePushVoters": [],
      "articleBooVoters": []
    }
  },
  {
    "id": "aggregation-interleaved-six-minutes-splits",
    "rules": ["THREAD-001"],
    "articleAuthor": "op",
    "rawPushes": [
      { "type": "neutral", "author": "alice", "content": "前段", "time": "01/01 12:00" },
      { "type": "neutral", "author": "bob", "content": "插入。", "time": "01/01 12:01" },
      { "type": "neutral", "author": "alice", "content": "六分鐘後", "time": "01/01 12:06" }
    ],
    "expected": {
      "replies": [
        { "author": "alice", "content": "前段", "replyToAuthor": null, "score": 0 },
        { "author": "bob", "content": "插入。", "replyToAuthor": null, "score": 0 },
        { "author": "alice", "content": "六分鐘後", "replyToAuthor": null, "score": 0 }
      ],
      "nativeArticleScore": 0,
      "articlePushVoters": [],
      "articleBooVoters": []
    }
  },
  {
    "id": "aggregation-forced-continuation-respects-boundaries",
    "rules": ["THREAD-001", "THREAD-002", "THREAD-006"],
    "articleAuthor": "op",
    "rawPushes": [
      { "type": "neutral", "author": "root-a", "content": "A。", "time": "01/01 12:00" },
      { "type": "neutral", "author": "root-b", "content": "B。", "time": "01/01 12:00" },
      { "type": "neutral", "author": "alice", "content": "回1樓：句號。||", "time": "01/01 12:01" },
      { "type": "neutral", "author": "alice", "content": "回1樓：同目標續接", "time": "01/01 12:03" },
      { "type": "neutral", "author": "bob", "content": "回1樓：不同作者", "time": "01/01 12:04" },
      { "type": "neutral", "author": "alice", "content": "回2樓：不同目標||", "time": "01/01 12:04" },
      { "type": "neutral", "author": "eve", "content": "中間事件。", "time": "01/01 12:05" },
      { "type": "neutral", "author": "alice", "content": "回2樓：超過五分鐘", "time": "01/01 12:10" }
    ],
    "expected": {
      "replies": [
        { "author": "root-a", "content": "A。", "replyToAuthor": null, "score": 0 },
        { "author": "root-b", "content": "B。", "replyToAuthor": null, "score": 0 },
        { "author": "alice", "content": "句號。\n同目標續接", "replyToAuthor": "root-a", "score": 0 },
        { "author": "bob", "content": "不同作者", "replyToAuthor": "root-a", "score": 0 },
        { "author": "alice", "content": "不同目標", "replyToAuthor": "root-b", "score": 0 },
        { "author": "eve", "content": "中間事件。", "replyToAuthor": null, "score": 0 },
        { "author": "alice", "content": "超過五分鐘", "replyToAuthor": "root-b", "score": 0 }
      ],
      "nativeArticleScore": 0,
      "articlePushVoters": [],
      "articleBooVoters": []
    }
  },
  {
    "id": "aggregation-full-and-non-full-lines",
    "rules": ["THREAD-003"],
    "articleAuthor": "op",
    "rawPushes": [
      { "type": "neutral", "author": "alice", "content": "滿行前段", "time": "01/01 12:00", "isFullWidthLine": true },
      { "type": "neutral", "author": "alice", "content": "直接接上", "time": "01/01 12:01" },
      { "type": "neutral", "author": "bob", "content": "未滿前段", "time": "01/01 12:02", "isFullWidthLine": false },
      { "type": "neutral", "author": "bob", "content": "換行接上", "time": "01/01 12:03" }
    ],
    "expected": {
      "replies": [
        { "author": "alice", "content": "滿行前段直接接上", "replyToAuthor": null, "score": 0 },
        { "author": "bob", "content": "未滿前段\n換行接上", "replyToAuthor": null, "score": 0 }
      ],
      "nativeArticleScore": 0,
      "articlePushVoters": [],
      "articleBooVoters": []
    }
  }
]
